{
  "$schema": "../../schema/traca.geometry.schema.v0.4.json",
  "meta": {
    "format": "TRACA_general_geometry",
    "version": "0.4.0",
    "case_id": "A3_OPPOSITE_SIDE",
    "source_revision": "fnv1a:f70db386",
    "status": "resolved",
    "authority": "provisional_visual_policy",
    "composition_fingerprint": "fnv1a:4b489db1",
    "canonical_promotion": false,
    "court_profile_ref": "IHF_INDOOR_HANDBALL_COURT_2025@1.0.0"
  },
  "court": {
    "width_m": 20,
    "half_length_m": 20,
    "goal": {
      "width_m": 3,
      "height_m": 2,
      "post_width_m": 0.08
    },
    "markings": {
      "goal_area_radius_m": 6,
      "goal_area_straight_m": 3,
      "free_throw_distance_m": 9,
      "free_throw_segment_m": 0.15,
      "free_throw_gap_m": 0.15,
      "penalty_line_distance_m": 7,
      "penalty_line_length_m": 1,
      "goalkeeper_line_distance_m": 4,
      "goalkeeper_line_length_m": 0.15,
      "throw_off_diameter_m": 4
    },
    "view_box": [
      -0.8,
      -1,
      21.6,
      15.136
    ]
  },
  "layout_policy": {
    "id": "generic_relational_layout_v0.4",
    "version": "0.4.0",
    "status": "provisional_render_policy",
    "coordinate_system": "metres_origin_goal_line_left",
    "attack_direction": "negative_y",
    "notes": [
      "Distribució derivada de delimitadors, corredors d’interval, dependències d’acció i relacions numèriques connectades.",
      "Les profunditats, separacions, marges de símbol i distàncies de contacte són política visual provisional.",
      "La validesa geomètrica no concedeix validació tàctica de l’entrenador."
    ],
    "parameters": {
      "id": "generic_relational_layout_v0.4",
      "version": "0.4.0",
      "defensive_area_clearance_m": 1.5,
      "minimum_defensive_depth_m": 6.8,
      "reception_free_throw_offset_m": 0.9,
      "ground_symbol_clearance_m": 0.48,
      "surpass_depth_m": 0.5,
      "staging_offset_y": 3,
      "feint_contact_distance_m": 0.9,
      "feint_break_lateral_m": 1.05,
      "feint_break_depth_m": 0.4,
      "feint_bypass_depth_m": 0.9,
      "feint_exit_lateral_m": 0.8,
      "feint_min_turn_degrees": 28,
      "defender_path_clearance_m": 0.58,
      "relation_support_distance_m": 1.45,
      "relation_min_attacker_separation_m": 1.4,
      "relation_max_defender_distance_m": 3.4,
      "ball_offset_m": 0.48
    },
    "decisions": [
      {
        "id": "LAYOUT_0001",
        "type": "court_aware_relational_delimiter",
        "target_ref": "STATE_D1_S0",
        "status": "provisional_visual_policy",
        "position": [
          6,
          6.954
        ],
        "source_refs": [
          "relation:delimiter:D1",
          "court:IHF_INDOOR_HANDBALL_COURT_2025",
          "coach_input:span:165-167",
          "coach_input:span:120-123",
          "space:INT_12",
          "canonical:interval:INT_12",
          "docs/DOMAIN_MODEL.md#3-espais-i-intervals",
          "coach_input:span:158-167"
        ]
      },
      {
        "id": "LAYOUT_0002",
        "type": "court_aware_relational_delimiter",
        "target_ref": "STATE_D2_S0",
        "status": "provisional_visual_policy",
        "position": [
          10,
          7.5
        ],
        "source_refs": [
          "relation:delimiter:D2",
          "court:IHF_INDOOR_HANDBALL_COURT_2025",
          "coach_input:span:93-95",
          "coach_input:span:120-123",
          "space:INT_12",
          "canonical:interval:INT_12",
          "docs/DOMAIN_MODEL.md#3-espais-i-intervals",
          "coach_input:span:68-71",
          "space:INT_23",
          "canonical:interval:INT_23"
        ]
      },
      {
        "id": "LAYOUT_0003",
        "type": "court_aware_relational_delimiter",
        "target_ref": "STATE_D3_S0",
        "status": "provisional_visual_policy",
        "position": [
          14,
          6.954
        ],
        "source_refs": [
          "relation:delimiter:D3",
          "court:IHF_INDOOR_HANDBALL_COURT_2025",
          "coach_input:span:68-71",
          "space:INT_23",
          "canonical:interval:INT_23",
          "docs/DOMAIN_MODEL.md#3-espais-i-intervals"
        ]
      },
      {
        "id": "LAYOUT_0004",
        "type": "legal_space_exit_after_defensive_line",
        "target_ref": "STATE_L_A003_EXIT",
        "status": "provisional_visual_policy",
        "position": [
          8,
          6.727
        ],
        "source_refs": [
          "space:INT_12",
          "coach_input:span:73-85",
          "coach_input:span:120-123"
        ]
      },
      {
        "id": "LAYOUT_0005",
        "type": "functional_space_anchor",
        "target_ref": "STATE_L_RECEPTION_A002",
        "status": "provisional_visual_policy",
        "position": [
          12,
          9.886
        ],
        "source_refs": [
          "space:INT_23",
          "coach_input:span:3-27",
          "coach_input:span:32-43",
          "coach_input:span:68-71"
        ]
      },
      {
        "id": "LAYOUT_0006",
        "type": "pass_sender_from_receiver",
        "target_ref": "STATE_CE_S0",
        "status": "provisional_visual_policy",
        "position": [
          9,
          12.886
        ],
        "source_refs": [
          "action:A001",
          "coach_input:span:3-10"
        ]
      },
      {
        "id": "LAYOUT_0007",
        "type": "reception_approach",
        "target_ref": "STATE_L_S0",
        "status": "provisional_visual_policy",
        "position": [
          14.4,
          12.886
        ],
        "source_refs": [
          "action:A002",
          "coach_input:span:20-27",
          "coach_input:span:3-27"
        ]
      },
      {
        "id": "LAYOUT_0008",
        "type": "connected_two_v_one_support",
        "target_ref": "STATE_PV_S0",
        "status": "provisional_visual_policy",
        "position": [
          4.55,
          6.877
        ],
        "source_refs": [
          "action:A004",
          "predecessor:A003",
          "coach_input:span:152-157",
          "coach_input:span:145-157"
        ]
      }
    ]
  },
  "zones": [],
  "spaces": [
    {
      "id": "INT_12",
      "kind": "relational_tactical_space",
      "relation": {
        "type": "between",
        "delimiter_refs": [
          "D1",
          "D2"
        ]
      },
      "anchor": [
        8,
        7.227
      ],
      "calculation_region": [
        [
          6.38,
          6.093
        ],
        [
          9.62,
          6.48
        ],
        [
          9.62,
          9.9
        ],
        [
          6.38,
          9.886
        ]
      ],
      "functional_anchors": {
        "reception": [
          8,
          9.886
        ],
        "threat": [
          8,
          8.127
        ],
        "exit": [
          8,
          6.727
        ]
      },
      "render_policy": "hidden",
      "source_refs": [
        "coach_input:span:120-123",
        "canonical:interval:INT_12",
        "docs/DOMAIN_MODEL.md#3-espais-i-intervals"
      ]
    },
    {
      "id": "INT_23",
      "kind": "relational_tactical_space",
      "relation": {
        "type": "between",
        "delimiter_refs": [
          "D2",
          "D3"
        ]
      },
      "anchor": [
        12,
        7.227
      ],
      "calculation_region": [
        [
          10.38,
          6.48
        ],
        [
          13.62,
          6.093
        ],
        [
          13.62,
          9.886
        ],
        [
          10.38,
          9.9
        ]
      ],
      "functional_anchors": {
        "reception": [
          12,
          9.886
        ],
        "threat": [
          12,
          8.127
        ],
        "exit": [
          12,
          6.727
        ]
      },
      "render_policy": "hidden",
      "source_refs": [
        "coach_input:span:68-71",
        "canonical:interval:INT_23",
        "docs/DOMAIN_MODEL.md#3-espais-i-intervals"
      ]
    }
  ],
  "objects": [],
  "phases": [],
  "entities": [
    {
      "id": "CE",
      "kind": "attacker",
      "label": "CE",
      "position": [
        9,
        12.886
      ],
      "state_ref": "STATE_CE_S0",
      "status": "derived",
      "presence": "explicit",
      "source_refs": [
        "coach_input:span:3-10"
      ]
    },
    {
      "id": "D1",
      "kind": "defender",
      "label": "D1",
      "position": [
        6,
        6.954
      ],
      "state_ref": "STATE_D1_S0",
      "status": "derived",
      "presence": "explicit",
      "source_refs": [
        "coach_input:span:165-167",
        "coach_input:span:120-123",
        "space:INT_12",
        "canonical:interval:INT_12",
        "docs/DOMAIN_MODEL.md#3-espais-i-intervals",
        "coach_input:span:158-167"
      ]
    },
    {
      "id": "D2",
      "kind": "defender",
      "label": "D2",
      "position": [
        10,
        7.5
      ],
      "state_ref": "STATE_D2_S0",
      "status": "derived",
      "presence": "explicit",
      "source_refs": [
        "coach_input:span:93-95",
        "coach_input:span:120-123",
        "space:INT_12",
        "canonical:interval:INT_12",
        "docs/DOMAIN_MODEL.md#3-espais-i-intervals",
        "coach_input:span:68-71",
        "space:INT_23",
        "canonical:interval:INT_23"
      ]
    },
    {
      "id": "L",
      "kind": "attacker",
      "label": "L",
      "position": [
        14.4,
        12.886
      ],
      "state_ref": "STATE_L_S0",
      "status": "derived",
      "presence": "explicit",
      "source_refs": [
        "coach_input:span:20-27",
        "coach_input:span:3-27"
      ]
    },
    {
      "id": "PV",
      "kind": "pivot",
      "label": "PV",
      "position": [
        4.55,
        6.877
      ],
      "state_ref": "STATE_PV_S0",
      "status": "derived",
      "presence": "explicit",
      "source_refs": [
        "coach_input:span:152-157",
        "coach_input:span:145-157"
      ]
    }
  ],
  "contextual_references": [
    {
      "id": "CONTEXT_D3",